Martin,Obama
"But a lot of people are deeply discouraged in this country. A lot of people are very disheartened by what they see, these open displays of racial hostility. Do you have some thoughts about that? And I don't think it's just younger people. I think a lot of older people, even if you had acknowledged as you just said that you never said you thought the society was post-racial. I think all kinds of analysts were jumping up and down when you were elected saying, ""It's not post-racial, it's not, it's structural, it's not fixed, it's not all fixed, that's too much to put on one person."" Even having said that a lot of people are very discouraged right now. And I wonder if you see that and I wonder what you would say to them.","Absolutely. There are times where I am sad, where I'm angry, where I'm hurting, where I feel obliged to buck up my wife or my daughters when we see not just the kinds of shocking injustice is as we saw with George Floyd, but also when you see elected officials, people in positions of responsibility not simply ignore dismiss these things but actually seem to suggest that it's OK. Yeah, I think it is completely understandable to feel discouraged and hurt and upset. I think the reason that I don't plunge into despair probably has to do with the fact that I tend to take a long view on things. You know, when I talk to Michelle or my daughters about these issues, I have to remind them I was 6 years old when the Supreme Court determined that it was unconstitutional for states to say that my parents couldn't marry. I mean, the Beatles were already the biggest musical group on Earth when anti-miscegenation laws are finally deemed unconstitutional [in] this country; it wasn't that long ago. And so, when I look at my lifetime — and I'm gray, I'm getting older, but you know, I'm not ancient, I'm still pretty spry — and you think about the changes that took place in my lifetime. Not just me being elected president. Michel, you being on a national broadcast as a lead journalist. That just didn't happen. Now that's not considered exceptional. Our kids can aspire to things that our parents certainly couldn't, and so that is not a cause for complacency, but it does give me some perspective. It would surprise me if you didn't have a big cross-section of the country that was still carrying around a bunch of baggage and still a little disturbed by the advances that African Americans had made. It would surprise me if changing demographics and the growing Latino population didn't scare a certain segment of this population, just because I know enough about American history to know that that's always been a fault line in American history. That fever, as you said, that's been a defining feature of a lot of our life. And the good news is, and it was reflected this summer, when you look at every indicator, every survey, if you just anecdotally look at popular culture, the younger generations are less impacted by those attitudes, are carrying around less of that baggage. Not none of it. There are white kids who were attracted to crazy white nationalist stuff on the Internet. But generally speaking, our kids' generation, you talk to them, and their attitudes instinctively are more open and not just on racial issues but on gender issues, on sexual orientation issues. And that is why I tend not to despair, but I still take it seriously because what I do know is that history doesn't move in a straight line. Attitudes can go backwards as well as forward. And all of us have to be vigilant in working as hard as we can to some of the better angels of our nature and put to rest some of the things that have been so destructive in American culture."
So a second volume is coming. ,Yes.
"This volume ends with the raid on the bin Laden compound, where you, after a long effort by the U S military and at your direction found Osama bin Laden and he was killed in that, in that raid. Why did you end there? ","You know, I thought it was a good place to stop. Originally, I was going to end with, uh, my reelection. But then, and I can't take credit for this. It was actually a suggestion of Cody Keenan, one of my former speechwriters who had read my pages, my draft. And he pointed out that it with bin Laden what you have is not just sort of a culmination of a lot of the incredible counterterrorism work that our administration had embarked on and really going after al-Qaida. And not only was it an example of government at its most effective, cooperating across agencies to carry out a very difficult and dangerous operation, but it was also occurring at the precise same moment that the dominant news was around Donald Trump's assertion that I was not born in this country and him seizing on the birther movement."
"And so what I thought was this would be a good place to end the first volume because it indicates the contrast between the serious work of government and these incredible folks from the Navy SEALs to Bill McRaven, who's the head of our special forces and engineers, this incredible operation, the diplomats, the intelligence officers, everybody who's having to coordinate hundreds of people under the most severe stress executing this incredible operation.","And yet the news is completely dominated during this period by an entirely bogus assertion by what I called at the time, a carnival barker. And it wasn't just Fox News that was obsessed with this. Every major media outlet. Some of the same people who later on would sort of decry Donald Trump and his very flimsy attachment to the truth were the same people who gave Donald Trump a big platform during this period. And so I'm sitting at the White House Correspondents' dinner with Donald Trump in attendance, and that's all anybody cares about at the same time as I've got people risking their lives about to take off to go to the Abbottabad compound."
"And I thought that that was a good place to end the first volume because it describes a choice that I think we have as a country. And that is as I say in my preface, is not settled by one election. And that is: Can we take the incredible dedication, cooperation, patriotism focus that we applied in the bin Laden raid? Can we take that and apply that to reducing poverty among children? Can we take that to focus and sense of common effort around dealing with climate change? Can we take that to make sure that our economy works for everybody and not just a few, can we apply that kind of seriousness to our common public life? Or are we going to continue to be pulled into this kind of reality TV, phony controversies and seeing these big issues as just matter of sport, and we've got one team and the other team and they hate each other and we're just going to go at it and it becomes a spectacle.","And as I said in my preface, I think that I place faith in this upcoming generation to make the right choice, but it is a choice that we're going to have to make."
Before we let you go. Who is this book for? ,"It's for your kids and my kids and the young people that I met, not just in this country but around the world, because part of the theme of the book is this contest of ideas. The way I describe it, these two visions: A vision that says that for all our differences, there is a common humanity and it is possible for us in a multiracial, multiethnic, highly diverse country and world, it is possible for us to see each other, understand each other and respect each other and work together."
"And then there's a contrasting idea that says we are a collection of tribes and we are inevitably at war and it's a zero-sum game, and that there are winners and losers and there's hierarchies of power and domination and subjugation. And it's not just in America, but it's around the world where those contrasting visions are duking it out.","And the truth is is that the vision of power and domination and subjugation, that's been the dominant. That's been the default of human societies for most of human history. This new way of doing things with democracy and individual rights and treating everybody as if they have worth and that have a voice in our government. That's new. It's an experiment that everybody's still watching. And so this book is for the generation that's coming up, these young people. I want them to understand that, in fact, they are going to be the ones who make the decision as to which way not only America goes, but the world goes, and that it is within their power to create a better world. And government is not something distant that happens to them, but it is something that they have a claim on and agency for and can shape and that's part of the reason why the arc of this volume starts with me as a young person and showing them that it's not like I was born inevitably to be president or that I was particularly good at all the aspects of public life, it was just that I hitched my wagon to something bigger and that I wasn't any different than them, and that if I can have an impact, they can, too."
"Mr. President, thank you so much for speaking with us. ",It was great to talk to you. Thank you so much.
